{
  "schemaVersion": "1.0.0",
  "datasetId": "ma-primary-2026-portraits",
  "kind": "portrait-dataset",
  "generatedAt": "2026-08-24T15:42:00Z",
  "codeRevision": "portrait-registry-v1",
  "coverage": {
    "candidateCount": 28,
    "publishedCount": 2,
    "reviewRequiredCount": 1,
    "initialsFallbackCount": 26
  },
  "portraits": [
    {
      "candidateId": "edward-markey",
      "displayName": "Edward J. Markey",
      "initials": "EM",
      "publicationStatus": "published",
      "display": {
        "kind": "image",
        "imageUrl": "https://raw.githubusercontent.com/unitedstates/images/aec3e4a88af843b282c0576f420b930f6a9a46ad/congress/450x550/M000133.jpg",
        "thumbnailUrl": "https://raw.githubusercontent.com/unitedstates/images/aec3e4a88af843b282c0576f420b930f6a9a46ad/congress/225x275/M000133.jpg",
        "alt": "Edward J. Markey, identity- and rights-verified portrait"
      },
      "identityVerification": {
        "status": "verified",
        "scope": "portrait_subject_only",
        "label": "Verified portrait",
        "tooltip": "The portrait subject and reuse rights were verified from cited sources. Ballot status is a separate evidence layer.",
        "method": "Exact Bioguide ID M000133 joins the congressional image path to current official Congress.gov and Senate profiles."
      },
      "rights": {
        "status": "verified",
        "license": "Public domain in the United States",
        "licenseUrl": "https://github.com/unitedstates/images#public-domain",
        "attribution": "Official congressional portrait via unitedstates/images",
        "attributionRequired": false,
        "changes": "Resized by the source repository."
      },
      "source": {
        "sourceRecordId": "portrait-source-edward-markey-m000133",
        "providerId": "unitedstates-congress-images",
        "sourcePageUrl": "https://github.com/unitedstates/images/tree/aec3e4a88af843b282c0576f420b930f6a9a46ad/congress",
        "checkedAt": "2026-08-24T15:42:00Z"
      },
      "capturedOn": null,
      "review": {
        "status": "automated_checks_passed",
        "reviewedAt": "2026-08-24T15:42:00Z",
        "reviewer": "civics-portrait-adapter",
        "notes": [
          "Verification covers the portrait subject and reuse rights; it does not independently verify ballot status or any political claim.",
          "The provider does not expose a capture date for this rendition."
        ]
      },
      "provenance": {
        "transformation": "verified-source-to-publishable-portrait",
        "sourceRecordIds": [
          "portrait-source-edward-markey-m000133"
        ]
      }
    },
    {
      "candidateId": "seth-moulton",
      "displayName": "Seth Moulton",
      "initials": "SM",
      "publicationStatus": "published",
      "display": {
        "kind": "image",
        "imageUrl": "https://raw.githubusercontent.com/unitedstates/images/aec3e4a88af843b282c0576f420b930f6a9a46ad/congress/450x550/M001196.jpg",
        "thumbnailUrl": "https://raw.githubusercontent.com/unitedstates/images/aec3e4a88af843b282c0576f420b930f6a9a46ad/congress/225x275/M001196.jpg",
        "alt": "Seth Moulton, identity- and rights-verified portrait"
      },
      "identityVerification": {
        "status": "verified",
        "scope": "portrait_subject_only",
        "label": "Verified portrait",
        "tooltip": "The portrait subject and reuse rights were verified from cited sources. Ballot status is a separate evidence layer.",
        "method": "Exact Bioguide ID M001196 joins the congressional image path to the current U.S. House Clerk and Biographical Directory profiles."
      },
      "rights": {
        "status": "verified",
        "license": "Public domain in the United States",
        "licenseUrl": "https://github.com/unitedstates/images#public-domain",
        "attribution": "Official congressional portrait via unitedstates/images",
        "attributionRequired": false,
        "changes": "Resized by the source repository."
      },
      "source": {
        "sourceRecordId": "portrait-source-seth-moulton-m001196",
        "providerId": "unitedstates-congress-images",
        "sourcePageUrl": "https://github.com/unitedstates/images/tree/aec3e4a88af843b282c0576f420b930f6a9a46ad/congress",
        "checkedAt": "2026-08-24T15:42:00Z"
      },
      "capturedOn": null,
      "review": {
        "status": "automated_checks_passed",
        "reviewedAt": "2026-08-24T15:42:00Z",
        "reviewer": "civics-portrait-adapter",
        "notes": [
          "Verification covers the portrait subject and reuse rights; it does not independently verify ballot status or any political claim.",
          "The provider does not expose a capture date for this rendition."
        ]
      },
      "provenance": {
        "transformation": "verified-source-to-publishable-portrait",
        "sourceRecordIds": [
          "portrait-source-seth-moulton-m001196"
        ]
      }
    },
    {
      "candidateId": "john-deaton",
      "displayName": "John Deaton",
      "initials": "JD",
      "publicationStatus": "review_required",
      "display": {
        "kind": "initials",
        "imageUrl": null,
        "thumbnailUrl": null,
        "alt": "John Deaton portrait awaits identity review; initials shown"
      },
      "identityVerification": {
        "status": "needs_review",
        "scope": "portrait_subject_only",
        "label": "Portrait review needed",
        "tooltip": "A possible portrait was found, but it is hidden until the subject match and reuse rights both pass publication checks.",
        "method": "The Commons record names John Deaton and traces the still to a John Deaton for US Senate campaign video, but it has no stable civic identifier to make the join deterministic."
      },
      "rights": {
        "status": "verified",
        "license": "CC BY 3.0",
        "licenseUrl": "https://creativecommons.org/licenses/by/3.0/",
        "attribution": "Jeff Dranetz / John Deaton for US Senate, via Wikimedia Commons",
        "attributionRequired": true,
        "changes": "Still image cropped from the source campaign video by a Wikimedia Commons contributor."
      },
      "source": {
        "sourceRecordId": "portrait-source-john-deaton-2024-commons",
        "providerId": "wikimedia-commons",
        "sourcePageUrl": "https://commons.wikimedia.org/wiki/File:John_Deaton,_2024_(cropped).jpg",
        "checkedAt": "2026-08-24T15:42:00Z"
      },
      "capturedOn": "2024-06-06",
      "review": {
        "status": "needs_review",
        "reviewedAt": "2026-08-24T15:42:00Z",
        "reviewer": "civics-portrait-adapter",
        "notes": [
          "A maintainer must confirm the subject-to-candidate match before publication.",
          "Until then the public view intentionally contains initials and no image URL."
        ]
      },
      "provenance": {
        "transformation": "candidate-source-held-behind-initials-fallback",
        "sourceRecordIds": [
          "portrait-source-john-deaton-2024-commons"
        ]
      }
    },
    {
      "candidateId": "maura-healey",
      "displayName": "Maura Healey",
      "initials": "MH",
      "publicationStatus": "fallback",
      "display": {
        "kind": "initials",
        "imageUrl": null,
        "thumbnailUrl": null,
        "alt": "Maura Healey portrait is not verified; initials shown"
      },
      "identityVerification": {
        "status": "unverified",
        "scope": "portrait_subject_only",
        "label": "Portrait unverified",
        "tooltip": "No identity- and rights-verified portrait has been published. Initials are shown instead.",
        "method": null
      },
      "rights": {
        "status": "not_researched",
        "license": null,
        "licenseUrl": null,
        "attribution": null,
        "attributionRequired": null,
        "changes": null
      },
      "source": {
        "sourceRecordId": null,
        "providerId": null,
        "sourcePageUrl": null,
        "checkedAt": "2026-08-24T15:42:00Z"
      },
      "capturedOn": null,
      "review": {
        "status": "unreviewed",
        "reviewedAt": null,
        "reviewer": null,
        "notes": [
          "Portrait enrichment has not produced a publishable source for this candidate."
        ]
      },
      "provenance": {
        "transformation": "default-initials-fallback",
        "sourceRecordIds": []
      }
    },
    {
      "candidateId": "michael-minogue",
      "displayName": "Michael Roger Minogue",
      "initials": "MM",
      "publicationStatus": "fallback",
      "display": {
        "kind": "initials",
        "imageUrl": null,
        "thumbnailUrl": null,
        "alt": "Michael Roger Minogue portrait is not verified; initials shown"
      },
      "identityVerification": {
        "status": "unverified",
        "scope": "portrait_subject_only",
        "label": "Portrait unverified",
        "tooltip": "No identity- and rights-verified portrait has been published. Initials are shown instead.",
        "method": null
      },
      "rights": {
        "status": "not_researched",
        "license": null,
        "licenseUrl": null,
        "attribution": null,
        "attributionRequired": null,
        "changes": null
      },
      "source": {
        "sourceRecordId": null,
        "providerId": null,
        "sourcePageUrl": null,
        "checkedAt": "2026-08-24T15:42:00Z"
      },
      "capturedOn": null,
      "review": {
        "status": "unreviewed",
        "reviewedAt": null,
        "reviewer": null,
        "notes": [
          "Portrait enrichment has not produced a publishable source for this candidate."
        ]
      },
      "provenance": {
        "transformation": "default-initials-fallback",
        "sourceRecordIds": []
      }
    },
    {
      "candidateId": "brian-shortsleeve",
      "displayName": "Brian Shortsleeve",
      "initials": "BS",
      "publicationStatus": "fallback",